<?xml version="1.0" encoding="UTF-8"?>
<themes xmlns:xsi="http://www.w3.org/2001/XMLSchema-instance"
    xsi:noNamespaceSchemaLocation="file:/C:/Users/Ngoc-Anh/Dropbox/FH/4.%20Semester/WBA2/Phase2/XSD/theme.xsd">
    <theme>
        <allgemeines theme_id="t0" bewertung="5">
            <theme_titel>Robust und Glitzernd</theme_titel>
            <genres>
                <genre>g0</genre>
            </genres>
            <kategorien>
                <kategorie>k0</kategorie>
            </kategorien>
        </allgemeines>
        <module>
            <dekoration>
                <dekoration_element>
                    <titel>Shine bright like a diamond!</titel>
                    <bild>http://www.tolle-dekoration.de/diamanten</bild>
                    <text>
                        <schritt>Silberpapier kaufen.</schritt>
                        <schritt>Mit Hilfe der Schablone Diamanten zeichen und ausschneiden.</schritt>
                        <schritt>Die ausgeschnitteten Diamanten an einer Schnur auffädeln.</schritt>
                    </text>
                </dekoration_element>
            </dekoration>
            <outfits>
                <outfit>
                    <titel>The girl's best friend</titel>
                    <bild>http://www.kleider.der/glitzer</bild>
                    <text>
                        <schritt>Dieses Kleid ist einzigartig. Man kann es bei pearliné boutique kaufen.</schritt>
                    </text>
                </outfit>
            </outfits>
            <musik>
                <song>
                    <song_titel>Shine bright like a diamond</song_titel>
                    <song_interpret>Rihanna</song_interpret>
                    <link>http://www.youtubed.de</link>
                </song>
                <song>
                    <song_titel>The girls best friend</song_titel>
                    <song_interpret></song_interpret>
                    <link>http://www.youtubed.de</link>
                </song>
            </musik>
            <catering>
                <gericht>
                    <rezeptname>Perlige Hochzeits-Torte</rezeptname>
                    <rezept_link>http://www.chefkoch.de</rezept_link>
                </gericht>
            </catering>
            <locations>
                <location>
                    <titel>Disneys Schloss</titel>
                    <bild>http://www.disneyland.de</bild>
                    <text>
                        <schritt>Für alle Prinzessinen.</schritt>
                    </text>
                </location>
            </locations>
        </module>
        <interaktion>
            <abonennten>
                <user>pearline</user>
                <user>pearlina</user>
                <user>CrackX</user>
                <user>RaverShawn</user>
                <user>lorainia</user>
                <user>Jorge Henrique Feraira Peraira</user>
                <user>Mama</user>
            </abonennten>
            <kommentare>
                <kommentar>
                    <nachricht>Dieses Kleid steht mir bestimmt super.</nachricht>
                    <user>Zyra</user>
                    <uhrzeit>2013-04-11T20:57:42.998+02:00</uhrzeit>
                </kommentar>
                <kommentar>
                    <nachricht>Wow!</nachricht>
                    <user>Nami</user>
                    <uhrzeit>2013-04-11T20:57:42.998+02:00</uhrzeit>
                </kommentar>
            </kommentare>
        </interaktion>
    </theme>
</themes>